{
  "observation_id": "uobs_01J000000000000000000000",
  "meter_id": "model.input_tokens",
  "meter_version": 1,
  "quantity": 1200,
  "unit": "token",
  "measurement_status": "confirmed",
  "evidence_reference": "https://evidence.agent.internal/provider-usage/uobs_01J000000000000000000000",
  "evidence_digest": "sha256:88c7ef6685a93713c9d1fa9a273d61a964eadc94b318115fc1a11c5e44e5e1c0",
  "occurred_at": "2026-07-16T09:02:00Z"
}
